{
  "schemaVersion": "v1.2",
  "federationId": "project-cdx-overlay-view",
  "duplicatePolicy": "This map is an overlay-local reference and does not establish federal authority. C:\\CEO\\project-cdx is the active workbench entry; C:\\Users\\enzo1\\PROJEC CDX is its physical alias. Runtime pointers recorded here are local references only. Federal coordination and fan-in resolve through universo-rey/cabina-universal-d and ownership through the applicable canonical registries.",
  "repos": [
    {
      "repoId": "project-cdx",
      "remote": "universo-rey/projec-cdx",
      "canonicalPath": "C:\\CEO\\project-cdx",
      "physicalAlias": "C:\\Users\\enzo1\\PROJEC CDX",
      "role": "overlay-workbench",
      "status": "active",
      "alignmentStatus": "aligned",
      "runtimePointer": {
        "canonicalRuntimeRoot": "C:\\CEO\\project-cdx\\.cabina\\SDU_RUNTIME_ROOT",
        "mode": "reference-only",
        "copyRuntime": false
      },
      "agents": [
        "orchestrator_agent",
        "contracts_agent",
        "validation_agent",
        "bus_agent",
        "observability_agent",
        "evidence_agent",
        "optimization_agent",
        "sanitizer_agent",
        "diagnostic_agent",
        "path_sanitizer_agent",
        "federation_enforcer_agent",
        "sns_agent",
        "vsi_execution_guard",
        "control_plane_agent"
      ],
      "contracts": [
        "contracts\\contract-map.json",
        "contracts\\agent-map.json",
        "contracts\\environment-contract.json"
      ],
      "environmentContract": "contracts\\environment-contract.json",
      "historicalPaths": [
        "C:\\CEO\\project-cdx\\SDU_RUNTIME_ROOT",
        "C:\\CEO\\project-cdx\\.cabina\\organizacion-total"
      ],
      "governance": {
        "ownerAgent": "seshat-normativa",
        "authorityLevel": "overlay-local-reference",
        "surface": "repo-local",
        "allowedActions": [
          "operate-local-overlay",
          "publish-overlay-reference",
          "publish-sns-reference"
        ],
        "blockedActions": [
          "copy-runtime-to-federated-repo",
          "high-live-write-without-explicit-auth",
          "out-of-binding-write",
          "secret-read",
          "production-mutation",
          "claim-federal-authority"
        ],
        "requiredRecipe": "cierre-wave-documental",
        "requiredTool": "manual-map-update",
        "evidence": "contracts\\federation-map.json",
        "validator": "json-parse-lightweight",
        "stopCondition": "project-cdx treated as federal root, control tower or global runtime authority"
      }
    },
    {
      "repoId": "agents-root",
      "remote": "universo-rey/agents-root",
      "canonicalPath": "C:\\Users\\enzo1\\.agents",
      "role": "capability-root-agents",
      "status": "reference",
      "alignmentStatus": "partial",
      "runtimePointer": {
        "canonicalRuntimeRoot": "C:\\CEO\\project-cdx\\.cabina\\SDU_RUNTIME_ROOT",
        "mode": "reference-only",
        "copyRuntime": false
      },
      "agents": [
        "federation_enforcer_agent",
        "sns_agent",
        "path_sanitizer_agent"
      ],
      "contracts": [
        "contracts\\federation-map.json"
      ],
      "environmentContract": "contracts\\environment-contract.json",
      "historicalPaths": [],
      "governance": {
        "ownerAgent": "seshat-normativa",
        "authorityLevel": "capability-reference",
        "surface": "user-profile-agents-root",
        "allowedActions": [
          "reference-skills",
          "reference-recipes",
          "reference-agent-index"
        ],
        "blockedActions": [
          "copy-runtime-to-federated-repo",
          "live-write",
          "secret-read",
          "production-mutation"
        ],
        "requiredRecipe": "agentes-atomicos-algoritmicos-en-waves",
        "requiredTool": "manual-map-update",
        "evidence": "SYSTEM_NERVOUS_INDEX.json",
        "validator": "json-parse-lightweight",
        "stopCondition": "agents root treated as active runtime"
      }
    },
    {
      "repoId": "codex-root",
      "remote": "universo-rey/codex-root",
      "canonicalPath": "C:\\Users\\enzo1\\.codex",
      "role": "capability-root-codex",
      "status": "reference",
      "alignmentStatus": "partial",
      "runtimePointer": {
        "canonicalRuntimeRoot": "C:\\CEO\\project-cdx\\.cabina\\SDU_RUNTIME_ROOT",
        "mode": "reference-only",
        "copyRuntime": false
      },
      "agents": [
        "federation_enforcer_agent",
        "sns_agent",
        "path_sanitizer_agent"
      ],
      "contracts": [
        "contracts\\federation-map.json"
      ],
      "environmentContract": "contracts\\environment-contract.json",
      "historicalPaths": [],
      "governance": {
        "ownerAgent": "seshat-normativa",
        "authorityLevel": "capability-reference",
        "surface": "user-profile-codex-root",
        "allowedActions": [
          "reference-skills",
          "reference-plugins",
          "reference-memory"
        ],
        "blockedActions": [
          "copy-runtime-to-federated-repo",
          "live-write",
          "secret-read",
          "production-mutation"
        ],
        "requiredRecipe": "cierre-wave-documental",
        "requiredTool": "manual-map-update",
        "evidence": "SYSTEM_NERVOUS_INDEX.json",
        "validator": "json-parse-lightweight",
        "stopCondition": "codex root treated as canonical runtime or secrets surface read"
      }
    },
    {
      "repoId": "cabina-universal-d",
      "remote": "universo-rey/cabina-universal-d",
      "canonicalPath": "C:\\Users\\enzo1\\Documents\\GitHub\\cabina-universal-d",
      "role": "federal-control-plane",
      "status": "active",
      "alignmentStatus": "aligned",
      "runtimePointer": {
        "canonicalRuntimeRoot": "C:\\CEO\\project-cdx\\.cabina\\SDU_RUNTIME_ROOT",
        "mode": "reference-only",
        "copyRuntime": false
      },
      "agents": [
        "federation_enforcer_agent",
        "sns_agent",
        "path_sanitizer_agent"
      ],
      "contracts": [
        "contracts\\federation-map.json"
      ],
      "environmentContract": "contracts\\environment-contract.json",
      "historicalPaths": [
        ".agents\\codex\\matrices",
        ".agents\\codex\\maps"
      ],
      "governance": {
        "ownerAgent": "rey.control_plane_orchestrator",
        "authorityLevel": "federal-control-plane-authority",
        "surface": "related-repo-local",
        "allowedActions": [
          "coordinate-federal-fan-in",
          "reference-readback",
          "reference-matrices"
        ],
        "blockedActions": [
          "copy-runtime-to-federated-repo",
          "live-write",
          "secret-read",
          "production-mutation"
        ],
        "requiredRecipe": "cierre-wave-documental",
        "requiredTool": "manual-map-update",
        "evidence": "contracts\\federation-map.json",
        "validator": "json-parse-lightweight",
        "stopCondition": "federal coordination bypassed or reassigned to an overlay"
      }
    },
    {
      "repoId": "cdf-soluciones",
      "remote": "SeshatSgin/cdf-soluciones",
      "canonicalPath": "C:\\Users\\enzo1\\Documents\\GitHub\\cdf-soluciones",
      "role": "domain-solution-reference",
      "status": "reference",
      "alignmentStatus": "pending",
      "runtimePointer": {
        "canonicalRuntimeRoot": "C:\\CEO\\project-cdx\\.cabina\\SDU_RUNTIME_ROOT",
        "mode": "reference-only",
        "copyRuntime": false
      },
      "agents": [
        "federation_enforcer_agent",
        "sns_agent",
        "path_sanitizer_agent"
      ],
      "contracts": [
        "contracts\\federation-map.json"
      ],
      "environmentContract": "contracts\\environment-contract.json",
      "historicalPaths": [],
      "governance": {
        "ownerAgent": "seshat-normativa",
        "authorityLevel": "domain-reference",
        "surface": "related-repo-local",
        "allowedActions": [
          "reference-repo",
          "route-to-canonical-runtime"
        ],
        "blockedActions": [
          "copy-runtime-to-federated-repo",
          "microsoft-live-write",
          "power-platform-mutation",
          "secret-read",
          "production-mutation"
        ],
        "requiredRecipe": "cierre-wave-documental",
        "requiredTool": "manual-map-update",
        "evidence": "contracts\\federation-map.json",
        "validator": "json-parse-lightweight",
        "stopCondition": "solution repo requires live gate or runtime copy"
      }
    },
    {
      "repoId": "jara-consultores",
      "remote": "SeshatSgin/jara-consultores",
      "canonicalPath": "C:\\Users\\enzo1\\Documents\\GitHub\\jara-consultores",
      "role": "domain-client-reference",
      "status": "reference",
      "alignmentStatus": "pending",
      "runtimePointer": {
        "canonicalRuntimeRoot": "C:\\CEO\\project-cdx\\.cabina\\SDU_RUNTIME_ROOT",
        "mode": "reference-only",
        "copyRuntime": false
      },
      "agents": [
        "federation_enforcer_agent",
        "sns_agent",
        "path_sanitizer_agent"
      ],
      "contracts": [
        "contracts\\federation-map.json"
      ],
      "environmentContract": "contracts\\environment-contract.json",
      "historicalPaths": [],
      "governance": {
        "ownerAgent": "seshat-normativa",
        "authorityLevel": "domain-reference",
        "surface": "related-repo-local",
        "allowedActions": [
          "reference-repo",
          "route-to-canonical-runtime"
        ],
        "blockedActions": [
          "copy-runtime-to-federated-repo",
          "live-write",
          "secret-read",
          "production-mutation"
        ],
        "requiredRecipe": "cierre-wave-documental",
        "requiredTool": "manual-map-update",
        "evidence": "contracts\\federation-map.json",
        "validator": "json-parse-lightweight",